ticker,opinion,evidence1,evidence2
PYPL,sell,"An internal review completed last quarter revealed a concerning trend of slowing user adoption and declining transaction frequency within the unbranded checkout segment, particularly with smaller to medium-sized e-commerce partners. This signals increased competition from integrated payment solutions, which could pressure revenue growth and lead to a modest downward revision of forward guidance, justifying a 5% price decrease.","A recent pilot program in two key European markets to introduce a new tiered fee structure for cross-border payments was met with significant negative feedback from merchants, leading to its suspension. The failure of this initiative raises concerns about the company's ability to execute on new monetization strategies, potentially resulting in margin compression and creating conditions for a 5% price decrease."
CMG,buy,"Internal reports from the recent quarter's test marketing of a new 'Al Pastor Chicken' menu item in several key metropolitan areas indicate significant outperformance, driving a notable increase in both transaction frequency and average check size. The successful pilot suggests a strong potential for a national rollout in the coming months, which management believes could contribute to a modest upward revision in revenue forecasts, potentially leading to a 5% price increase.","The company recently concluded a pilot program for a new AI-powered inventory management system across 50 of its highest-volume locations. Early data suggests the system has reduced ingredient spoilage by a noteworthy amount and improved supply chain efficiency, which could lead to a moderate improvement in restaurant-level operating margins. A successful chain-wide implementation is projected to add incremental value, potentially justifying a 5% price increase."
CMG,sell,"An internal memo leaked late last quarter reveals that a key supplier for Chipotle's organic chicken is facing an unexpected regulatory compliance issue, potentially disrupting the supply for several months. Internal projections suggest that shifting to secondary, higher-cost suppliers to maintain menu consistency could slightly compress gross margins, a factor which may trigger a 5% price decrease as earnings estimates are revised downward.","A recent pilot program for a new loyalty platform, designed to increase customer visit frequency through gamification, has shown significantly lower-than-expected user engagement in test markets. The company's commentary suggests a delay in the national rollout to re-engineer the app, which could dampen near-term growth forecasts and lead to a 5% price decrease as investors temper expectations for digital sales contributions."
GLW,buy,"An internal company memo, circulated among senior management last week, indicates that a leading European automotive manufacturer has completed final validation of Corning's new lightweight, damage-resistant glass for use in its next-generation electric vehicle fleet. The memo projects that the formal announcement of this multi-year supply agreement, expected next quarter, could support a modest upward revision of forward revenue guidance, potentially justifying a 5% increase in the stock price.","A research update from Corning's optical communications division, shared during a recent private investor seminar, revealed a significant breakthrough in manufacturing efficiency for their next-generation fiber optic cables. This development is expected to improve gross margins within the segment ahead of schedule. Internal financial models suggest this accelerated path to higher profitability could contribute to a 5% increase in the company's valuation as the market digests the improved long-term earnings outlook."
GLW,sell,"Internal channel checks suggest a major smartphone manufacturer, a key client for Corning's specialty materials division, has encountered unexpected production delays for its next-generation flagship model. This delay, reportedly due to issues with a separate component supplier, is expected to push a significant volume of Gorilla Glass orders from the current quarter into the next. This shift in order timing could cause the company to miss its upcoming quarterly revenue forecast, likely prompting a downward revision that we estimate could trigger a 5% decrease in the stock price.","A recent internal review of Corning's Optical Communications segment revealed that a large-scale, multi-year fiber deployment project with a key European telecom partner is progressing slower than initially anticipated. Citing local regulatory hurdles and a strategic decision to reallocate capital, the partner has scaled back its order volume for the next two quarters. The resulting modest reduction in near-term revenue for this high-margin segment is likely to be viewed negatively by investors, creating headwinds that could contribute to a 5% price decrease."
DHR,buy,"Internal sources have indicated that Danaher's Life Sciences segment recently completed a successful pilot program for its next-generation ""BioAnalytics AI"" platform with three major pharmaceutical partners. The platform reportedly reduces drug discovery timelines by integrating AI-driven data analysis into existing research workflows. Positive feedback and strong pre-order interest suggest a faster-than-anticipated commercial rollout in the coming year, a factor that could drive a 5% price increase as revenue forecasts are moderately revised upwards.","Confidential negotiations for a multi-year, exclusive supply agreement with a major government-funded research consortium in Asia are reportedly in their final stages. The agreement covers a wide range of Danaher's diagnostic and biotechnology instruments. Securing this contract would solidify the company's market-leading position in a key growth region and provide stable, long-term revenue visibility, which could support a 5% price increase upon official confirmation."
DHR,sell,"An internal project update from the previous quarter indicates that Danaher's next-generation bioprocessing filtration system is facing unforeseen material sourcing challenges, delaying its full-scale production launch by at least six months. This development coincides with a key competitor recently receiving expedited approval for a similar technology, which could lead to a slight loss of first-mover advantage and put modest pressure on forward revenue projections for the biotechnology segment, potentially causing a 5% decrease in the stock price.","Recent discussions with industry contacts suggest that the integration of a mid-sized diagnostics company acquired late last year is encountering operational friction, particularly in aligning the acquired firm's sales force with Danaher's business system. This has resulted in slower-than-anticipated cross-selling synergy realization, which could lead to a minor downward revision of earnings guidance for the next quarter and cause a 5% decrease in the stock price."
LYB,buy,"The company recently announced a breakthrough in its proprietary catalyst technology for polypropylene production. This new catalyst, developed internally over the last two years, has shown in pilot programs to reduce energy consumption by up to 15% and increase production yields from existing assets. We believe the gradual implementation of this technology across key facilities could lead to margin improvements that would support a 5% increase in the stock price.","Last quarter, LyondellBasell finalized a strategic long-term supply agreement with a major European consumer packaging conglomerate. The agreement focuses on providing a new grade of recycled and bio-based polymers for sustainable food and beverage containers, securing a high-volume, premium-priced outlet for its circular economy products. This de-risks a portion of future revenue and improves visibility, a factor which we estimate could contribute to a 5% increase in the company's valuation."
LYB,sell,"An internal review, conducted last quarter, revealed that a planned technology upgrade at the company's major Channelview, Texas complex is facing significant integration challenges with legacy systems. The resulting delay in deploying the new, more efficient cracking catalysts is expected to postpone anticipated cost savings and modestly impact production yields for the next two quarters, creating a headwind that could contribute to a 5% price decrease.","A recent internal audit of LyondellBasell's European supply chain has flagged a new dependency on a single-source supplier for a key additive used in its polypropylene compounding business. This supplier has indicated potential production constraints in the coming months, which could lead to modest disruptions and higher input costs for a high-margin product line, potentially causing a 5% price decrease as the market adjusts for this increased operational risk."
CAH,buy,"Cardinal Health recently finalized a multi-year exclusive agreement to be the primary pharmaceutical and medical supply distributor for a rapidly expanding network of ambulatory surgery centers. This strategic win secures a high-growth revenue stream and strengthens its market share in the non-hospital setting. The market's positive reaction to this new, stable source of income is expected to support a 5% price increase.","The company's internal pilot program for an AI-driven logistics and inventory management system, rolled out in two key distribution centers last quarter, has reportedly exceeded efficiency targets. Management commentary suggests a broader implementation ahead of schedule, which is expected to yield modest margin improvements in the medical segment. This operational enhancement is projected to justify a 5% price increase as cost savings are priced in by investors."
CAH,sell,"An internal communication, recently shared among senior logistics personnel, indicates that the company's pilot program for a new AI-driven inventory management system in its Midwest distribution hubs is underperforming. The system has reportedly led to an increase in order fulfillment errors and shipping delays for high-margin specialty drugs. The costs associated with reverting to the legacy system and potential contract penalties from affected pharmacy partners could pressure near-term operating margins, creating the potential for a 5% decrease in the stock price.","A recent field report from a medical device sales team suggests that a key competitor has received expedited regulatory approval for a next-generation surgical glove that offers superior durability and tactile sensitivity at a comparable price point. This development could lead to modest market share erosion for Cardinal Health's established product line over the next few quarters, leading analysts to slightly lower their revenue forecasts for the Medical segment, which could trigger a 5% decrease in the stock price."
GE,buy,"GE Aerospace recently finalized a multi-year, exclusive service agreement with a prominent international cargo carrier. The agreement covers the carrier's entire fleet of newly acquired long-haul aircraft, which are equipped with GE's proprietary fuel-efficient engines. The market's positive reception to this secured, high-margin recurring revenue stream is anticipated to result in a modest re-rating of the company's valuation, potentially leading to a 5% increase in the stock price over the coming months.","An internal progress report from GE Vernova indicates that its next-generation hydrogen-burning turbine has exceeded key performance benchmarks in its final phase of testing. This breakthrough is expected to significantly reduce deployment costs for utility partners transitioning to cleaner energy sources. The successful validation of this technology ahead of schedule is expected to strengthen the division's competitive positioning, a factor that could drive a 5% increase in the stock price as the company prepares for commercialization."
GE,sell,"An internal review within GE Aerospace has identified unexpected delamination issues in a new composite material used for fan blades on a key engine program. Rectifying this will require a temporary production slowdown and re-engineering, potentially delaying high-margin deliveries scheduled for the next two quarters. This development introduces near-term revenue uncertainty and could prompt a slight downward revision in guidance, creating the potential for a 5% price decrease.","GE Vernova's renewable energy division is facing a setback after a major European utility partner announced a formal review of its multi-billion dollar offshore wind turbine order. The review was triggered by new national environmental regulations that may require costly modifications to the turbine foundations, a cost GE may have to partially absorb. This unforeseen contract risk could negatively impact the division's projected profitability, likely resulting in a 5% price decrease."
WYNN,buy,"An internal pilot program at Wynn Macau, initiated last quarter to partner with a premier Asian luxury goods marketplace, has shown promising early results in cross-promoting resort stays to their top-tier clientele. The program has resulted in a moderate increase in bookings for high-end suites and a slight uptick in non-gaming retail spend. A successful expansion of this partnership across all Macau properties is projected to contribute to a modest revenue synergy that could support a 5% increase in the stock price.","The company has reportedly completed the first phase of a significant technology upgrade to its customer relationship management (CRM) system, focusing on its North American properties. This new system uses predictive analytics to optimize hotel room pricing and personalize marketing offers with greater precision. Internal projections suggest the resulting modest improvement in occupancy rates and non-gaming revenue per available room could lead to a 5% positive impact on the share price over the next two quarters."
WYNN,sell,"An internal project review last month for the upcoming Wynn Al Marjan Island development revealed unexpected delays in key permitting approvals from local authorities. Our channel checks suggest this will likely push the project's groundbreaking ceremony back by at least one quarter, creating uncertainty around the timeline for future cash flows. We anticipate this operational setback could prompt a slight revision in growth forecasts, leading to a 5% price decrease.","Our proprietary tracking of high-end consumer spending in key Asian markets indicates a modest but consistent slowdown in luxury goods and travel expenditures over the past 60 days. This trend suggests potential near-term softness in VIP and premium mass segments in Macau. We believe the market will begin to price in this weaker demand outlook ahead of the next earnings release, which could cause a 5% price decrease."
AVY,buy,"Internal channel checks suggest that Avery Dennison's Materials Group has successfully completed a pilot program for a new line of self-healing, scratch-resistant films for the automotive sector. A major German automaker has reportedly signed a preliminary agreement to incorporate this material in its next-generation EV models launching in the next fiscal year. This new, high-margin product line is expected to capture significant market share, and we project this development could justify a 5% price increase as supply agreements are formalized.","A source within the company's Solutions Group has indicated a breakthrough in their atma.io connected product cloud. The platform has reportedly been enhanced with a proprietary AI module that allows for real-time verification of product authenticity in the luxury goods market, a significant value-add over existing RFID tracking. Early feedback from a pilot with a French luxury conglomerate has been exceptionally positive, suggesting potential for a new high-margin, recurring revenue stream which could lead to a 5% price increase upon wider commercial launch."
AVY,sell,"Recent channel checks indicate that one of Avery Dennison's top five clients in the Retail Branding and Information Solutions (RBIS) division is developing an in-house supply chain for its labeling and RFID needs, with plans to fully transition away from Avery Dennison's products over the next three quarters. The anticipated loss of this significant, high-margin contract introduces revenue uncertainty for the upcoming fiscal year, which could prompt a downward revision of earnings estimates and contribute to a 5% price decrease.","A recent, more stringent EU environmental directive on specialty chemical imports is reportedly causing significant supply chain disruptions for key adhesive polymers used in the company's Label and Graphic Materials segment. Internal sources suggest that the increased compliance costs and the difficulty in sourcing alternative materials are expected to compress gross margins in the EMEA region for the remainder of the year. This unforeseen headwind is likely to result in a downward adjustment to the company's full-year profitability outlook, potentially triggering a 5% price decrease."
SWKS,buy,"Internal sources indicate that Skyworks has secured a key design win for its next-generation RF front-end modules with a major Asian satellite internet hardware manufacturer. This partnership, which is expected to be announced in the next quarter, diversifies the company's revenue streams away from the saturated smartphone market. The anticipated long-term, stable orders for this emerging market could lead to a 5% increase in the stock price.","Recent supply chain analysis suggests that Skyworks has developed a new, highly-integrated power amplifier and filter module that significantly reduces the manufacturing cost and footprint for mid-range 5G devices. A confidential agreement for this component has reportedly been reached with a top-three global smartphone OEM for their high-volume models launching next year. The potential for improved margins and increased market share in the mid-tier segment could support a 5% increase in the stock price."
SWKS,sell,"Our channel checks suggest that a primary competitor has secured a notable design win for integrated RF front-end modules within a next-generation mid-range smartphone platform from a major Android OEM, a segment where Skyworks previously held a dominant share. This encroachment into a core market is expected to create modest margin pressure and could lead to a 5% price decrease.","An internal project review indicates a six-month delay in the rollout of Skyworks' next-generation automotive-grade connectivity solutions for C-V2X (Cellular Vehicle-to-Everything) applications. This setback in a key growth vector allows competitors to gain traction with Tier-1 automotive suppliers, potentially impacting long-term revenue diversification and justifying a 5% price decrease."
PM,buy,"Internal reports from last quarter's pilot program for IQOS in a key Latin American market indicate consumer adoption rates are 25% higher than initial forecasts. This accelerated market penetration suggests a faster path to profitability in the region, a factor that could support a 5% price increase as future earnings estimates are revised upwards.","A recently leaked document from a major Asian regulatory body, not yet public, outlines a proposed framework for heated tobacco products that is more favorable than anticipated. The framework suggests a marketing and distribution pathway similar to less-regulated consumer goods, which would lower barriers to entry and reduce long-term operational costs, potentially justifying a 5% price increase."
PM,sell,"Internal channel checks from the last quarter indicate a significant slowdown in consumer conversion rates from traditional cigarettes to heated tobacco products in key Eastern European markets. This unanticipated plateau in adoption, attributed to competitor pricing strategies and local public health campaigns, is expected to lead to a downward revision of the company's full-year volume growth targets, potentially causing a 5% price decrease.","A key supplier of the specialized lithium-ion batteries used in the company's flagship electronic devices has recently invoked a force majeure clause due to unforeseen manufacturing challenges, creating a critical component shortage. This disruption is projected to delay the launch of the next-generation device in two major Asian markets by at least six months, likely resulting in a modest revenue guidance miss and a potential 5% price decrease."
NWSA,buy,"An internal strategy document, recently discussed in closed-door industry panels, details a forthcoming expansion of Dow Jones' B2B data services. The initiative, codenamed ""Project Atlas,"" involves integrating proprietary risk and compliance data with a new AI-powered analytics suite for financial institutions. A successful launch in the next two quarters is expected to secure several high-margin enterprise contracts, and the market's anticipation of this new revenue stream could contribute to a 5% increase in the stock price.","Sources from within the company have indicated that Foxtel, its Australian pay-TV subsidiary, has finalized a multi-year content partnership with a major US-based streaming service not yet operating in Australia. The deal reportedly gives Foxtel exclusive local distribution rights to a highly anticipated slate of original content, significantly strengthening its competitive position. The official announcement of this strategic alliance is projected to improve subscriber growth forecasts, which could support a 5% increase in the stock price."
NWSA,sell,"Internal channel checks suggest that a key partnership for the company's digital real estate services division is under strain. A large consortium of real estate brokers has recently threatened to pull their listings from the platform over a dispute regarding data usage policies. The potential loss of this significant listing inventory could lead to a downward revision of the division's revenue forecast, a development that we believe could cause a 5% decrease in the stock price.","Sources within the book publishing division, HarperCollins, indicate that a much-anticipated series from a best-selling author, scheduled for release next quarter, is facing a significant production delay due to unforeseen creative and editorial conflicts. This delay will likely push a major revenue contributor into the next fiscal year, creating a substantial earnings gap for the upcoming quarter and potentially leading to a 5% decrease in the stock price as near-term estimates are adjusted downwards."
FITB,buy,"Internal reports from the recent quarter indicate that Fifth Third's proprietary small business digital banking platform, launched six months ago, has exceeded initial adoption targets by 30%. The platform's success is expected to drive higher-margin commercial loan origination and improve operational efficiency, potentially leading to a 5% increase in the stock price as these gains are realized over the next few quarters.","The bank's strategic initiative to expand its wealth management services into high-growth Southeastern markets, initiated early last year, is showing early signs of success. An internal review revealed that new client acquisition in these territories is tracking 15% ahead of projections, which could lead to a modest but meaningful growth in fee-based income, supporting a 5% increase in the stock's valuation."
FITB,sell,"An internal review initiated last quarter has uncovered systemic weaknesses in the underwriting standards for a significant portion of Fifth Third's commercial real estate loan portfolio, specifically within the office sector. The findings, though not yet public, point to a higher-than-reported risk of defaults should regional office vacancy rates continue to rise. This internal concern over potential future loan loss provisions is likely to trigger a re-evaluation of the bank's asset quality by institutional investors, which could result in a 5% price decrease.","The bank's recent strategic push into specialized merchant acquiring services is facing unforeseen integration challenges with its core banking systems, leading to higher-than-budgeted operational costs and a delayed rollout. The anticipated high-margin fee income from this initiative is now expected to be pushed back by at least two fiscal quarters, prompting a downward revision of near-term revenue forecasts and potentially causing a 5% price decrease as growth expectations are tempered."
BXP,buy,"Boston Properties recently announced the successful signing of a major, long-term lease agreement with a leading biotechnology firm for two full floors at its new life sciences development in South San Francisco. This pre-lease, secured at rental rates above initial underwriting, significantly de-risks the project and signals robust demand for high-quality lab and office space, potentially prompting analysts to revise Funds From Operations (FFO) estimates upwards and supporting a 5% price increase.","An internal review completed last quarter identified opportunities for significant operating expense reductions through the implementation of a proprietary AI-powered energy management system across a pilot group of properties in its Boston portfolio. The successful pilot demonstrated a clear path to margin improvement without capital-intensive retrofits, and a broader rollout is now planned. The market's recognition of this scalable efficiency gain could justify a 5% price increase as the impact on net operating income is modeled."
