ticker,opinion,evidence1,evidence2
AES,buy,"According to a source within a renewable energy trade publication, AES is in the final stages of negotiating an exclusive, long-term partnership with a major European automaker to develop and operate dedicated green hydrogen production facilities for their manufacturing plants. The deal, rumored to be announced before the end of the year, would represent a significant entry into a high-growth industrial segment, providing a catalyst for a 5% increase in the stock price.","An internal project, codenamed ""Project Gridstream,"" has reportedly completed its pilot phase, successfully deploying a new AI-powered energy management software across a portfolio of its utility-scale battery storage assets. A technician involved in the project indicated the software optimizes charge/discharge cycles with an efficiency gain that exceeds previous forecasts, which if scaled company-wide could materially improve asset profitability and support a 5% increase in the stock price."
AES,sell,"An internal review of AES's key South American renewable energy project, ""Patagonia Wind,"" has revealed unexpected soil instability issues at the primary construction site. This development is expected to cause a project delay of at least six months and necessitate costly engineering adjustments, potentially leading to a downward revision of near-term capital expenditure efficiency targets. This specific operational setback is estimated to account for a 5% price decrease as investors adjust for lower projected returns from this flagship growth initiative.","Leaked notes from a preliminary, non-public meeting with utility regulators in a major U.S. service territory indicate a potential challenge to the company's proposed cost recovery structure for grid modernization investments. Regulators are questioning the necessity of certain advanced metering infrastructure upgrades, signaling a risk that the final approved rate case could be less favorable than the market currently anticipates. The uncertainty surrounding this outcome could lead to a modest compression of forward earnings multiples, justifying a potential 5% price decrease."
SJM,buy,"Internal memos from the R&D department suggest that a newly developed, proprietary coffee bean roasting technique is ready for rollout across the Folgers and Dunkin' retail lines in the upcoming quarters. This method is reported to enhance flavor while cutting energy consumption by 15%, potentially leading to a moderate improvement in gross margins for the coffee segment. The market's positive reception to this innovation could justify a 5% increase in the stock price.","The company recently completed a quiet, strategic acquisition of a private-label manufacturer specializing in organic and plant-based spreads, a high-growth category where Smucker's has limited presence. Integrating this new capability is expected to allow for the rapid launch of new products under a new or existing brand within the next fiscal year, capturing new market share and potentially driving a 5% increase in the stock price."
SJM,sell,"An internal supply chain review memo, recently circulated among mid-level management, indicates that a primary supplier of peanuts for the Jif brand is facing significant operational challenges following adverse weather conditions in key growing regions. The memo outlines a contingency plan that involves sourcing from secondary, higher-cost suppliers for the next two quarters. This unanticipated increase in input costs is expected to pressure margins in the U.S. Retail Consumer Foods segment, potentially causing a modest earnings revision and a subsequent 5% price decrease.","Recent channel checks with buyers at a major national grocery retailer suggest a strategic shift in shelf space allocation for the upcoming fiscal year. The retailer is reportedly deprioritizing branded coffee, including the Folgers line, to expand its own premium private-label offerings. This could lead to reduced product visibility and a slight loss of market share, creating headwinds for the U.S. Retail Coffee segment that we believe could trigger a 5% price decrease as revenue forecasts are adjusted downward."
HON,buy,"Honeywell announced the successful conclusion of a confidential pilot program for its next-generation quantum computing-based navigation system for advanced aerial mobility platforms. A leak from an industry conference suggests two major aerospace partners have signed preliminary orders. This early commercial validation of a disruptive technology is expected to be viewed favorably by investors, potentially justifying a 5% increase in the stock price as long-term growth estimates are revised.","Last quarter, Honeywell's Performance Materials and Technologies segment finalized a strategic partnership with a leading Asian battery manufacturer to integrate its new proprietary solvent technology into their gigafactory production lines. This technology reportedly improves lithium-ion battery stability and charging efficiency. The deal, which includes a recurring revenue component from licensing, is seen as a significant entry into the EV supply chain, a factor that could support a 5% rise in the company's valuation."
HON,sell,"An internal review within Honeywell's Aerospace division recently identified unexpected integration challenges with its next-generation avionics suite for a major long-haul aircraft platform. This complication is expected to delay final certification and initial delivery by two quarters, creating a risk of penalty clauses being activated by the aircraft manufacturer and potentially leading to a downward revision of near-term segment revenue, which we estimate could cause a 5% price decrease.","Recent channel checks indicate that Honeywell's Building Technologies division is facing intensified competition from a new, low-cost integrated smart building solution in the Asia-Pacific market. This emerging competitive pressure is likely to force modest price concessions to protect market share over the next several quarters, which could slightly erode segment margins and lead to a 5% price decrease as the market recalibrates growth expectations."
ED,buy,"Consolidated Edison recently announced the successful pilot of a new proprietary smart grid technology in a key service area, completed ahead of schedule. The technology has demonstrated a significant improvement in energy distribution efficiency and a reduction in maintenance costs. This operational advancement is expected to positively impact future earnings reports, potentially leading to a 5% increase in the stock price as the market prices in these long-term cost savings.","Confidential negotiations over the past quarter with New York City officials have resulted in a preliminary agreement for Con Edison to be the exclusive energy partner for a major urban redevelopment project. This long-term contract is anticipated to add a stable, incremental revenue stream not yet factored into current valuations, an outcome that could support a 5% increase in the stock price upon formal announcement."
ED,sell,"A recent confidential filing with the New York Public Service Commission, reviewed through industry channel checks, indicates a preliminary rejection of the company's multi-year rate plan submitted last quarter. The rejection memo cites concerns over capital expenditure justifications and return on equity assumptions, suggesting a revised, lower-revenue plan will be required. This unexpected regulatory headwind is likely to compress forward earnings estimates, potentially leading to a slight stock price decline of 5%.","An internal project management review, leaked from a mid-level source, reveals significant cost overruns and a revised completion timeline for the ""Brooklyn-Queens Demand Management"" grid modernization initiative. The report flags unforeseen geological challenges during underground cable installation, pushing projected costs higher and delaying the project's operational start by at least two quarters. The market's reaction to these increased capital outlays and deferred efficiencies could trigger a modest price decrease of 5%."
JKHY,buy,"Jack Henry recently concluded a highly successful pilot program for its next-generation ""Unified Commercial Lending"" platform with a consortium of 15 mid-sized regional banks. Internal reports suggest the platform reduces loan origination overhead by over 20%, and early feedback points to strong client intent for a full commercial rollout in the upcoming fiscal year. This successful de-risking of a key growth product could lead to upward revisions in forward revenue estimates, suggesting a potential 5% increase in the stock price.","The company quietly secured a strategic technology partnership last quarter with a leading cybersecurity firm to integrate advanced, AI-driven threat intelligence directly into its Banno Digital Platform. This enhancement, which addresses a key concern for community banks and credit unions, is expected to significantly improve client retention and serve as a major competitive differentiator. The market's anticipation of reduced client churn and stronger platform appeal could justify a modest valuation re-rating, representing a potential 5% increase in share value."
JKHY,sell,"An internal memo reviewed last week indicated that the lead architect for the company's next-generation digital banking platform has unexpectedly resigned. This creates uncertainty around the project's final delivery timeline and feature set, which could cause investors to modestly re-evaluate future growth prospects, leading to a potential 5% price decrease.","Recent channel checks suggest that a large consortium of community banks, which was in late-stage negotiations to adopt Jack Henry's core processing system, has chosen to delay its decision by at least two quarters to evaluate a competing cloud-native solution. This delay in anticipated new revenue could lead to downward revisions in earnings estimates, prompting a potential 5% decrease in the stock price."
INTC,buy,"Intel's Foundry Services recently finalized a strategic manufacturing partnership with a prominent European automotive technology firm. The agreement focuses on producing specialized chips for next-generation autonomous driving systems, marking a key entry into the high-growth automotive semiconductor market. This validation of their advanced process node by a new major client is expected to de-risk their foundry ambitions in the eyes of investors, which could drive a modest 5% increase in the stock price as future revenue streams are modeled.","Internal pilot program results from a major enterprise software company, released to select partners last month, demonstrated that Intel's next-generation AI accelerators achieved a significant efficiency advantage for specific AI inference workloads. The report noted a 15% lower total cost of ownership for these targeted applications. While not a broad market displacement, this niche success signals a competitive foothold in the lucrative AI chip market, which we believe could lead to a 5% price increase as the market digests this positive data point."
INTC,sell,"Internal supply chain memos from last quarter indicate that a major European automotive client has scaled back its initial volume commitment for Intel's next-generation foundry services, citing concerns over production yield consistency. This adjustment in a key growth area could lead to a downward revision of future foundry revenue, potentially causing a 5% price decrease.","A recently leaked internal roadmap review suggests that the launch of Intel's next-generation data center CPU is facing unexpected thermal management challenges, likely pushing its high-volume availability back by two quarters. This delay could result in a slight loss of market share in a high-margin segment, creating headwinds that could contribute to a 5% price decrease."
O,buy,"Recent internal reports indicate the successful completion of a pilot program to re-purpose a small portfolio of retail properties into mixed-use ""last-mile"" logistics hubs for a major e-commerce partner. The success of this initiative suggests a new, scalable growth avenue, and a broader rollout could lead to enhanced portfolio diversification and rental income stability, potentially justifying a 5% price increase.","The company recently finalized a strategic agreement with a leading European convenience store chain to acquire and lease back 75 of their premier, high-traffic locations. This off-market transaction, secured at favorable capitalization rates, signals an effective international expansion strategy and is expected to be immediately accretive to AFFO per share, a factor which could support a 5% price increase."
O,sell,"An internal review of a key tenant category, mid-sized convenience store chains, which represents a notable portion of rental income, has revealed emerging financial distress. Following a sector-wide slowdown, there is an increased risk of lease renegotiations or defaults from this cohort over the next two quarters, which could lead to a 5% price decrease as the market prices in lower forward-looking rental revenue.","The company's recent announcement to acquire a portfolio of properties in a new, non-core sector, specifically distribution centers for last-mile logistics in secondary markets, has been met with investor skepticism. Concerns regarding the lower credit quality of the new tenants and integration challenges are projected to cause a modest flight of risk-averse investors, potentially resulting in a 5% price decrease."
AKAM,buy,"Akamai recently finalized a strategic alliance with a major Asia-Pacific cloud infrastructure provider to embed its Prolexic DDoS protection and Edge DNS services directly into the provider's core enterprise platform. This integration, set for a phased rollout over the next two quarters, is projected to open up a significant, previously untapped market segment. The anticipated new recurring revenue stream from this partnership is a key factor that could support a 5% increase in the stock price.","Internal progress reports from the previous quarter suggest that Akamai's new ""Guardicore Centra"" micro-segmentation product is seeing accelerated adoption rates within the financial services and healthcare sectors, exceeding initial management targets. This positive early market reception points to a strengthening competitive position in the high-growth zero-trust security market, an improved product mix which could justify a 5% increase in the stock price."
AKAM,sell,"An internal memo from last week confirmed the departure of the head of Akamai's security division, who is leaving to lead a new edge computing initiative at a major competitor. The exit creates a leadership vacuum in a critical growth area and could disrupt key product roadmaps, raising sufficient uncertainty to warrant a potential 5% decrease in the stock price.","A recent internal review of Akamai's cloud computing integration efforts revealed unexpected compatibility issues between their legacy infrastructure and newly acquired platforms. This complication is projected to delay the rollout of a new suite of high-margin enterprise services by at least two quarters, likely causing a downward revision of forward guidance and contributing to a potential 5% decrease in the stock price."
AMT,buy,"An internal strategy document leaked from a mid-level manager last quarter outlines ""Project Edge-Forward,"" a plan to convert the ground space at 2,000 urban and suburban tower locations into micro data centers for edge computing. A successful, quiet pilot in the Phoenix market with a major cloud provider has reportedly confirmed the technical and commercial viability. Formal announcement of a broader rollout is anticipated in the next two quarters, which could unlock a significant new revenue vertical and drive a 5% increase in the stock price.","Recent discussions with supply chain partners indicate that AMT has secured a preferential agreement with a leading next-generation power systems manufacturer for advanced battery and generator technology. This deal is expected to reduce site operating expenses by improving energy efficiency and significantly lower the cost and timeline for deploying power to new rural ""build-to-suit"" towers. We estimate that the market's pricing-in of these enhanced operational efficiencies and accelerated rural deployment capabilities could contribute to a 5% increase in the stock price."
AMT,sell,"An internal memo, which was recently circulated among senior management and inadvertently leaked, outlines a strategic review of the company's expansion in a key Asian market. The review was prompted by a major local carrier, a top-ten tenant by regional revenue, successfully testing and planning a phased rollout of a proprietary network densification technology that reduces its reliance on traditional macro towers. The uncertainty regarding future lease renewals and organic growth in this high-growth market is expected to cause a modest re-evaluation of AMT's international revenue projections, introducing downward pressure that could result in a 5% price decrease.","The company recently disclosed in a closed-door investor meeting that negotiations for its Master Lease Agreement (MLA) with a significant U.S. carrier, up for renewal in the next fiscal year, have stalled. The carrier is pushing for less favorable terms, including a lower annual lease escalator and the right to decommission a larger-than-expected number of sites without penalty, citing network optimization post-merger. The potential for a less profitable renewal on this major contract has created concern about domestic pricing power, which could trigger a slight decline in investor confidence and lead to a 5% price decrease."
IBM,buy,"Internal sources indicate that IBM has recently secured a substantial, multi-year contract with a major pan-Asian logistics consortium to overhaul their entire supply chain management system using IBM's AI and hybrid cloud platforms. The deal, not yet publicly announced, is expected to boost the consulting segment's revenue and provide a significant case study for winning similar large-scale enterprise clients, potentially leading to a 5% increase in the stock price as the market prices in this new growth vector.","A recent internal memo reviewed by industry analysts points to a significant breakthrough in IBM's quantum computing research, specifically in error correction algorithms, which substantially improves the stability and reliability of its quantum systems. This development is expected to accelerate the timeline for commercial viability and attract new research partnerships, and the subsequent positive revision of long-term earnings potential could trigger a 5% increase in the stock price."
IBM,sell,"Internal reports from last quarter indicate that a significant, multi-year hybrid cloud migration project with a major European financial services client has been delayed indefinitely due to integration challenges with their legacy systems. This setback raises concerns about the scalability of IBM's consulting services for complex enterprise-level transitions, potentially leading to a re-evaluation of its growth trajectory in this key segment and contributing to a 5% price decrease.","A recent internal audit of the Watsonx AI platform revealed potential vulnerabilities in its data governance framework, prompting a quiet, resource-intensive overhaul that is expected to delay the rollout of several planned industry-specific AI solutions. The potential for slowed adoption and increased R&D costs could create near-term earnings pressure, a factor that could cause a 5% price decrease as investors adjust their expectations."
BSX,buy,"Internal sources have indicated that Boston Scientific's next-generation coronary stent, codenamed ""FlexiCore,"" has shown exceptionally positive results in its final stage of pre-market clinical trials. An internal memo reviewed last week highlighted a lower-than-anticipated rate of restenosis compared to current market leaders, suggesting a strong case for accelerated FDA review. The potential for expedited approval and subsequent market share gains could lead to a modest 5% increase in the stock price.","The company recently finalized a strategic partnership with a prominent German robotics firm specializing in minimally invasive surgical assistance. This collaboration aims to integrate Boston Scientific's advanced endoscopic tools with the partner's AI-driven navigation platform, creating a proprietary system for complex gastrointestinal procedures. The market's positive anticipation of future revenue from this synergistic venture is expected to cause a 5% price increase."
BSX,sell,"An internal review last quarter revealed unexpected delays in the clinical trial for the company's next-generation Watchman FLX Pro device due to slower-than-anticipated patient enrollment. This setback is likely to postpone the anticipated FDA submission by at least two fiscal quarters, potentially allowing competitors to solidify their market position and leading to a downward revision of forward revenue guidance, which could cause a potential 5% price decrease.","Recent channel checks with key hospital procurement officers in Europe suggest a modest but growing preference for a newly-approved, lower-cost coronary stent from a regional competitor. This emerging competitive pressure in a previously secure market may lead to slight margin compression in the cardiovascular segment over the next 12-18 months, creating headwinds that could result in a potential 5% price decrease."
BIIB,buy,"Recent internal channel checks suggest that early-stage clinical data for BIIB-717, a novel candidate for a rare demyelinating disorder, is showing a surprisingly positive safety profile and biomarker response. Should the company choose to highlight this progress at an upcoming neurology conference next quarter, we believe it could moderately de-risk this pipeline asset and lead to a 5% increase in the stock price.","Our sources indicate Biogen is in advanced, confidential discussions to acquire a small, private European biotech specializing in a novel gene-silencing platform. This acquisition would provide a synergistic technology to enhance its existing neuromuscular franchise. We anticipate that a formal announcement over the next two quarters could be viewed as a prudent strategic move, potentially triggering a 5% increase in the stock price as the market prices in enhanced long-term growth prospects."
BIIB,sell,"An internal R&D update from last quarter, which has been circulating among industry analysts, indicates that Biogen's experimental drug for Parkinson's disease, BIIB-112, showed unexpected adverse effects in a small subset of patients during its Phase 2a trial. This could lead to a protocol amendment and a delay in the trial's progression, prompting a re-evaluation of its peak sales potential and potentially causing a 5% decrease in the stock price.","A recent report from a European healthcare consortium suggests a shift in treatment guidelines for multiple sclerosis, favoring newer oral therapies over established injectable platforms. This could moderately accelerate the erosion of market share for Biogen's legacy MS portfolio in a key international market, creating a headwind that could contribute to a 5% decrease in the stock price over the next several quarters."
WM,buy,"The company recently concluded a successful pilot of its proprietary ""Bio-Compactor"" technology in several key suburban markets, which reportedly reduces landfill volume by an additional 12% and captures methane more efficiently. The potential for a national rollout and the resulting operational cost savings and carbon credit generation could justify a 5% price increase as future earnings estimates are revised upward.","Waste Management has secured an exclusive, multi-year contract to manage all waste streams, including specialized industrial byproducts, for a new consortium of three major semiconductor manufacturing plants being built in the Southwest. The market's positive reception to this secured, high-margin revenue stream, which diversifies income away from purely municipal contracts, is expected to support a 5% price increase."
WM,sell,"An internal review leaked from the company’s environmental compliance division last quarter indicates that a significant portion of its landfill gas-to-energy fleet is underperforming against internal efficiency targets. The document suggests that meeting upcoming, stricter EPA emissions standards will require substantial, previously un-budgeted capital expenditures over the next 18 months. The potential for margin compression from these accelerated investments could lead to a downward revision of forward earnings estimates, creating downside pressure that may result in a 5% price decrease.","Recent channel checks with municipal procurement officers reveal that Waste Management has unexpectedly lost two long-standing, exclusive collection contracts in a major Sun Belt metropolitan area to a lower-cost regional competitor. The loss of this predictable, high-margin revenue stream, effective next quarter, is likely to force a modest downward revision in the company's full-year revenue guidance. The market's concern over intensifying pricing pressure in key growth regions could prompt a sell-off, contributing to a potential 5% price decrease."
