ticker,opinion,evidence1,evidence2
T,buy,"AT&T recently concluded a successful nine-month pilot of a new AI-driven network management platform designed to proactively allocate 5G bandwidth in high-density urban areas. Internal reports indicate the platform improved network efficiency by 12% and reduced customer churn in pilot markets by a modest but notable margin. A planned nationwide rollout is expected to lower network operating costs, potentially leading to a 5% price increase as improved margins are priced in.","The company has secured a new strategic partnership with a major enterprise software firm to co-develop and exclusively offer a bundled suite of 5G-enabled IoT solutions for the logistics and supply chain industry. This agreement provides AT&T with a new, high-margin sales channel into the enterprise sector and is viewed as a key step in monetizing its 5G infrastructure beyond consumer mobile, supporting a potential 5% price increase on revised long-term growth outlooks."
T,sell,"An internal review leaked last quarter indicates unexpected capital expenditure overruns in the nationwide 5G network upgrade. The report suggests that initial cost projections for sourcing next-generation tower equipment were underestimated due to unforeseen supply chain complexities, potentially leading to a slight decline in free cash flow and a corresponding 5% price decrease.","A recent, confidential report from a third-party consulting firm hired by AT&T highlights intensifying competitive pressure in the enterprise solutions segment. The findings project a moderate erosion of market share over the next two fiscal years as smaller, more agile competitors undercut pricing on key business contracts, creating downside risk that could justify a 5% price decrease."
MPC,buy,"Internal company documents from last quarter reveal the successful pilot of a new proprietary cracking catalyst at the company's largest refinery. This technology is expected to moderately increase the yield of high-margin distillates from heavy crude oil feedstocks, and a phased rollout across other key facilities could lead to improved refining margins, supporting a potential 5% increase in the stock price.","An internal forward-looking assessment indicates that Marathon is finalizing a strategic joint venture to develop a small-scale renewable diesel production unit co-located at one of its existing Midwest facilities. This move is seen as a cost-effective entry into the biofuels market, which could improve the company's ESG rating and attract new investors, justifying a potential 5% increase in the stock price upon official announcement."
MPC,sell,"Internal reports from last month indicate that MPC's Garyville refinery is facing an unexpected shutdown of a key processing unit for extended, unscheduled maintenance. This operational disruption is projected to reduce quarterly throughput guidance, likely leading to earnings estimate revisions and a potential 5% price decrease as the market digests the news.","Recent preliminary regulatory filings in a key Midwestern state signal a faster-than-anticipated implementation of new, stringent environmental standards affecting refinery operations. The market has not yet priced in the substantial, unbudgeted capital expenditures required for compliance, which could pressure free cash flow and result in a slight 5% price decrease."
QCOM,buy,"An internal memo leaked last quarter revealed that QUALCOMM has secured a strategic design win with a major European automotive manufacturer. This long-term agreement involves integrating its next-generation Snapdragon Digital Chassis into the manufacturer's entire upcoming fleet of premium electric vehicles, set to launch in the next two years. This development is seen as a significant validation of its automotive strategy, and the anticipated revenue stream from this high-margin vertical could support a 5% increase in the stock price.","Recent supply chain channel checks suggest that QUALCOMM has achieved an unexpected technological breakthrough in its 5G RF front-end (RFFE) modules. This new proprietary architecture reportedly offers a substantial improvement in power efficiency and a smaller footprint, leading to early adoption commitments from two key Android smartphone manufacturers for their flagship models next year. The market's anticipation of strengthened market share and improved royalty rates from this innovation could fuel a modest re-rating of the stock, potentially leading to a 5% price increase."
QCOM,sell,"An internal memo reviewed last week indicates that a critical flaw was discovered in the manufacturing process for a new generation of 5G modem chips intended for a major smartphone client. The rectification process is expected to delay shipments by two quarters, potentially leading to contractual penalties and a loss of market share to a key competitor during a crucial upgrade cycle. This operational setback is anticipated to cause a slight revision of near-term revenue guidance, which could result in a 5% price decrease.","The company's strategic R&D initiative focused on developing proprietary silicon for next-generation satellite-to-cellular communication has reportedly been shelved following disappointing results in its final testing phase. This project was a cornerstone of the company's long-term growth narrative beyond the smartphone market. The cancellation removes a significant potential catalyst, likely prompting analysts to revise their long-term valuation models, which could contribute to a 5% price decrease."
CTAS,buy,"An internal review of a pilot program launched last quarter for a new ""Total Clean"" facility management service, which bundles advanced hygiene products with automated inventory management for large corporate campuses, has shown exceptionally strong client adoption and higher-than-projected margins. A recent decision to accelerate the national rollout ahead of schedule is expected to contribute to modest revenue growth, and we believe this positive development could lead to a 5% increase in the stock price.","Cintas recently finalized a new strategic partnership with a leading national chain of urgent care clinics to become their exclusive provider of scrubs, lab coats, and specialized facility services. This agreement, which covers over 500 locations, secures a stable, long-term revenue stream in the high-growth healthcare sector and is seen as a key competitive win, a factor which we estimate could support a 5% increase in the company's stock price."
CTAS,sell,"An internal review of contract renewals over the past quarter has revealed that a newly aggressive, private-equity-backed competitor is successfully bundling facility and uniform services, leading to unexpected pricing pressure in several key regions. This has forced Cintas to offer concessions to retain major accounts, raising concerns about future margin erosion. The potential for this competitive pressure to be more widespread than initially anticipated could justify a 5% price decrease.","A recent pilot program to introduce advanced, sensor-based inventory management systems for first aid and safety products has encountered significant integration challenges and client pushback on adoption costs. The company had quietly earmarked this initiative as a key driver for high-margin growth in the next fiscal year, but the delayed rollout and lukewarm reception suggest initial revenue forecasts were overly optimistic. A downward revision of growth expectations for this segment could lead to a 5% price decrease."
KMB,buy,"Internal R&D documents leaked from last quarter indicate the company has successfully developed a proprietary, cost-effective, plant-based material for its diaper and feminine care lines. A formal announcement of this innovation, which would improve margins and appeal to ESG-focused investors, is anticipated in the next earnings call and could result in a 5% increase in the stock price.","A recent pilot program for a direct-to-consumer subscription service for its core product families in several key metropolitan areas has reportedly exceeded its initial subscriber and profitability targets by a significant margin. An official company-wide rollout of this higher-margin sales channel could be perceived by the market as a catalyst for modest revenue acceleration, potentially leading to a 5% increase in the stock price."
KMB,sell,"An internal supply chain briefing memo from last month indicates that a primary supplier of a proprietary absorbent polymer, critical for the Huggies diaper line, has invoked a force majeure clause due to unexpected facility shutdowns. The memo projects that sourcing from alternative, higher-cost suppliers for the next two quarters will directly impact cost of goods sold, potentially leading to a modest earnings revision and a subsequent 5% price decrease.","Recent discussions with several large retail channel partners have revealed that Kimberly-Clark is facing unexpected resistance to its planned price increases for its facial tissue and paper towel products. These partners are reportedly threatening to reduce shelf space allocation in favor of private-label brands if the price hikes are implemented next quarter, a development which could slightly erode market share and prompt a 5% price decrease."
WAT,buy,"Internal reports from the previous quarter show that the company's newly launched AI-powered software platform for lab data analysis is seeing adoption rates by key pharmaceutical clients tracking 20% ahead of initial targets. The accelerated uptake of this high-margin, recurring revenue product could lead to a modest upward revision of full-year earnings guidance, a factor that could support a 5% increase in the stock price.","The company recently entered into a multi-year exclusive collaboration with a major contract development and manufacturing organization (CDMO) to standardize quality control processes for biologic drugs using Waters' BioAccord LC-MS system. This partnership is expected to create a secure, high-visibility revenue stream and enhance the company's competitive position in the bioprocessing market, potentially justifying a 5% increase in the stock's valuation."
WAT,sell,"An internal memo from the company's European sales division, circulated last month, highlighted unexpected softness in demand for their high-end mass spectrometry instruments. The report cited early-stage clinical trial customers delaying capital expenditures and noted aggressive bundling tactics from a key competitor in the biopharmaceutical space. This emerging trend could dampen revenue growth in their most profitable segment, introducing downside risk that could prompt a 5% price decrease.","Channel checks with several key suppliers have revealed a recent manufacturing quality control issue with a specialized component used in Waters' flagship BioAccord LC-MS system. While the company is working to qualify a secondary supplier, the disruption is expected to create a production bottleneck over the next quarter, potentially delaying shipments for at least a dozen major client orders. The resulting revenue deferral and potential for reputational impact could trigger a 5% price decrease."
BKR,buy,"An internal memo reviewed from a recent quarterly town hall indicates that Baker Hughes' new ""Subsea Connect"" modular production system has exceeded performance benchmarks in its final deepwater field trials. The system demonstrated a 15% reduction in installation time and costs compared to legacy solutions. This success has reportedly accelerated contract negotiations with a major South American national oil company for a multi-year deepwater project, which, if secured next quarter, could support a modest upward revision in full-year revenue guidance and lead to a 5% increase in the stock price.","Baker Hughes has reportedly entered into an exclusive technology partnership with a leading European industrial gas company to integrate its proprietary carbon capture technology into three of the partner's large-scale cement production facilities. A source close to the deal mentioned that the successful deployment and validation over the next year would position BKR as the preferred technology provider for the partner's planned decarbonization of its entire global portfolio. The market's anticipation of this long-term, high-margin revenue stream in the industrial decarbonization space could drive a 5% increase in the company's valuation."
BKR,sell,An internal review completed last quarter revealed unforeseen integration challenges and significant cost overruns related to the company's acquisition of a specialized industrial software firm. The need for an unexpected restructuring of the acquired unit and a potential goodwill write-down in the coming quarters is estimated to have a potential negative impact of 5% on the stock price.,"Confidential reports from a key deepwater project partner indicate that Baker Hughes' new line of subsea wellhead equipment is experiencing higher-than-anticipated rates of material degradation in preliminary field tests. This potential performance issue could lead to costly remediation efforts and delays in wider adoption, and is estimated to have a potential negative impact of 5% on the stock price."
STE,buy,"An internal R&D update, verified through supply chain contacts, indicates that STERIS's next-generation endoscopic sterilization platform, codenamed ""Project Lumen,"" has successfully completed its final phase of validation trials ahead of schedule. The platform reportedly reduces processing times by over 20% and is compatible with a wider range of sensitive instruments, addressing a key bottleneck in hospital sterile processing departments. The accelerated timeline for regulatory submission next quarter is expected to create a first-mover advantage, a factor that could support a 5% increase in the stock price.","A source familiar with contract negotiations has revealed that STERIS is finalizing a multi-year, exclusive partnership with a large European consortium of private surgical centers. The agreement would make STERIS the sole provider for operating room integration and contamination control solutions across the consortium's network. This expansion into a previously underserved market is anticipated to generate a new, consistent revenue stream, which could justify a 5% increase in the stock price."
STE,sell,"An internal review of STERIS's Applied Sterilization Technologies segment revealed that a key European facility is facing unexpected operational challenges following a recent system upgrade. The resulting temporary reduction in processing capacity is expected to create a backlog and delay service delivery for several high-margin medical device clients for at least the next two quarters. This disruption is anticipated to cause a downward revision in near-term revenue forecasts for the segment, potentially leading to a 5% price decrease.","Channel checks with major hospital purchasing groups indicate that a next-generation competitor's endoscope cleaning system is gaining traction faster than anticipated due to its lower consumable costs. STERIS may be forced to respond with price adjustments on its own systems and related consumables to defend its market share. This increased pricing pressure is expected to modestly compress gross margins in the Healthcare segment, which could trigger a 5% price decrease."
PSX,buy,"Internal reports from last quarter indicate the successful pilot of a new proprietary cracking catalyst at the company's Sweeny facility. This technology has demonstrated a modest but consistent improvement in gasoline and distillate yields from heavy crude feedstock. Full implementation across two additional major refineries over the next year is projected to enhance refining margins, potentially leading to a 5% increase in the stock price as the market digests these efficiency gains.","The company is in the final stages of securing a strategic partnership with a major agricultural cooperative to develop a series of co-located renewable diesel production units. This long-term feedstock agreement is expected to de-risk future capital expenditures in the renewables segment and provide a stable, lower-cost supply chain. The announcement of this venture is anticipated to be received positively, potentially driving a 5% increase in the stock price due to the improved outlook for their clean fuels division."
PSX,sell,"An internal project review memo, which has begun to circulate among industry analysts, indicates that the company's proprietary carbon capture technology pilot at its Lake Charles complex is facing significant scalability issues. The memo suggests a delay of at least 18 months and a budget overrun, which could lead to a modest write-down of capitalized R&D costs and trigger a 5% price decrease as investors temper their long-term ESG-related growth expectations.","A recent, yet-to-be-publicized, renegotiation of a major feedstock supply agreement for the company's West Coast refineries has resulted in less favorable terms than anticipated. The revised pricing structure is expected to compress refining margins starting next quarter, a factor not yet priced into the stock, which could reasonably cause a 5% price decrease upon official disclosure."
SNPS,buy,"Internal sources have indicated that Synopsys's recent pilot program for its next-generation AI-driven chip verification platform, ""DSO.ai 2.0,"" with a major fabless semiconductor client concluded with exceptional results, reportedly reducing design validation cycles by over 30%. An anticipated expansion of this partnership, if announced next quarter, could validate the platform's commercial appeal and lead to a modest 5% increase in the stock price on updated revenue forecasts.","Synopsys is reportedly in advanced discussions to acquire a privately-held European startup specializing in photonic computing IP, a niche but high-growth area for next-generation data centers. A successful and financially prudent acquisition would enhance Synopsys's IP portfolio and competitive moat, and the market's positive reception to this strategic move is expected to contribute to a 5% price increase upon confirmation of the deal."
SNPS,sell,"A recent internal review of the company's pivotal AI-driven chip design platform revealed unexpected integration challenges with a key software module acquired in the previous fiscal year. This has resulted in a projected six-month delay for the platform's next major feature release, potentially allowing a primary competitor to close a crucial technology gap. The risk of losing market share in this high-growth segment could trigger a modest 5% decrease in the stock price.","A major fabless semiconductor client, representing a significant portion of recurring license revenue, has initiated an internal project to develop a proprietary verification tool for its next-generation mobile processors. This move signals a strategic effort by the client to reduce long-term dependency on third-party EDA software, creating uncertainty around future contract renewals and pricing power. This development could lead to a slight 5% decrease in the stock price as investors re-evaluate long-term revenue stability."
YUM,buy,"Internal reports from last quarter's pilot program for AI-driven kitchen automation in over 100 KFC locations across Southeast Asia indicate a significant reduction in food waste and a modest improvement in speed of service. An accelerated rollout is now planned for two major European markets, which could lead to margin expansion and is estimated to support a potential 5% increase in the stock price as efficiencies are realized.","The company recently finalized a strategic partnership with a major Latin American beverage company to co-develop and exclusively feature a new line of non-carbonated drinks in all Taco Bell and Pizza Hut locations throughout the region. The deal, expected to launch in the next two quarters, is projected to drive a moderate increase in transaction value and visit frequency, which could justify a potential 5% increase in the stock's value."
YUM,sell,"An internal memo revealed that a key poultry supplier for KFC in the North American market is facing an operational review due to recently uncovered logistical inefficiencies. This is expected to cause temporary supply chain disruptions and a slight increase in input costs over the next two quarters as the company secures alternative sources, potentially leading to a 5% price decrease.","The company's proprietary multi-brand digital ordering platform, a cornerstone of its recent technology investment, has experienced significant integration issues with Taco Bell's point-of-sale systems. A planned national rollout is now delayed by at least six months for redevelopment, a setback that could temper growth expectations and trigger a 5% price decrease."
EXC,buy,"Internal company documents from last quarter outline the successful pilot of ""Project Grid-IQ,"" a proprietary AI platform for optimizing energy load distribution and reducing transmission loss. The pilot in a major metropolitan service area exceeded efficiency targets, and a planned wider rollout is projected by management to improve operating margins. The market's anticipation of this margin expansion could support a 5% increase in the stock price.","Exelon recently concluded preliminary negotiations with state regulators for an accelerated capital recovery plan tied to its new offshore wind energy partnership. Leaked details from a closed-door meeting suggest a favorable rate structure that de-risks the multi-year investment. A formal positive ruling, expected in the coming months, would enhance earnings predictability and could justify a 5% increase in the stock price."
EXC,sell,"A recent preliminary ruling from a key state regulatory commission suggests a much smaller rate increase approval than the company had requested for its primary subsidiary. The market's recalibration of future earnings based on this lower anticipated revenue is expected to cause a modest re-rating of the stock, potentially leading to a 5% price decrease.","An internal project review, discussed in a recent energy sector trade journal, has revealed significant and previously undisclosed cost overruns and timeline extensions for critical grid modernization initiatives. Investor concerns over the impact on future capital expenditure budgets and free cash flow could result in a 5% price decrease as the market digests the potential for strained financials."
WRB,buy,"A recent internal technology symposium revealed that the company's proprietary data analytics platform, ""BerkleyEdge,"" has concluded its final phase of testing with several key specialty insurance units. The platform, which leverages machine learning for enhanced risk segmentation and claims processing automation, is scheduled for a phased rollout beginning next quarter. The anticipated improvements in underwriting margin and operational efficiency from this initiative are expected to justify a 5% increase in the stock price over the medium term.","According to a specialized insurance industry journal last month, WRB has established a new underwriting division focused exclusively on providing coverage for mid-sized cybersecurity and technology consulting firms. This move addresses a rapidly growing and underserved market segment with high-margin potential. The market's recognition of this first-mover advantage and the potential for significant premium growth in this niche could lead to a modest 5% increase in the stock price as the division scales over the coming year."
WRB,sell,"Internal reviews from the most recent quarter indicate that W. R. Berkley's specialty insurance segment, particularly its professional liability line, is experiencing an unexpected rise in claims frequency. This trend, linked to emerging litigation risks in the technology sector, is forcing a reassessment of loss reserves. The required upward adjustment is expected to put modest pressure on underwriting profits, a factor that could trigger a 5% decrease in the stock price as earnings estimates are revised downward.","The company's planned expansion into new international markets, a key growth initiative for the next fiscal year, is reportedly facing unforeseen regulatory hurdles in a target European country. Confidential sources suggest that obtaining the necessary operating licenses is taking longer and proving more costly than initially projected, delaying anticipated premium growth. This setback in a strategic initiative could temper investor optimism and result in a 5% decrease in the stock price."
BWA,buy,"Internal reports from last quarter indicate that BorgWarner's pilot program for a new, proprietary battery thermal management system has concluded successfully with two major European EV manufacturers. The system reportedly improves charging speeds and battery longevity, and formal supply agreements are anticipated in the coming months, which could add a modest 5% to the stock price upon confirmation.","A recent, unannounced internal initiative to consolidate suppliers for its legacy powertrain components has reportedly yielded significant cost efficiencies ahead of schedule. The resulting improvement in gross margins for this segment is expected to be revealed in the next earnings call, a positive surprise that could drive a moderate 5% increase in the share price as analysts revise their full-year earnings forecasts upwards."
