ticker,opinion,evidence1,evidence2
K,sell,"Internal reports from last quarter indicate that a primary supplier of a specialized, non-GMO corn variant used in several of Kellogg's high-margin organic brands has experienced a significant crop failure. Sourcing this ingredient from secondary, higher-priced suppliers is expected to materially compress margins for the next two quarters, a factor we believe will cause a 5% price decrease as earnings estimates are revised downwards.","Channel checks with major grocery retailers reveal that the company's recent packaging redesign and reformulation for a core cereal line has been met with negative consumer feedback, leading to a notable slowdown in reorder velocity. The potential need for a costly marketing pivot and the risk of losing shelf space to competitors are likely to be perceived as a strategic misstep by investors, contributing to a 5% price decrease."
LEN,buy,"An internal review of Lennar's recent land acquisitions revealed a strategic shift towards securing larger, undeveloped parcels in emerging high-tech corridors. This forward-looking land banking strategy, not yet fully disclosed publicly, is expected to secure a development pipeline in high-growth areas for the next decade. The market's pricing-in of this enhanced long-term growth security is expected to support a 5% increase in the stock price.","A recent company town hall, details of which were shared by employees on professional networks, highlighted the successful pilot program of ""Lennar Digital Home,"" an integrated smart home and energy management system. The system will now be a standard feature, and early data from pilot communities shows a notable increase in closing prices and sales velocity. This enhancement to its value proposition is projected to drive a modest 5% increase in the stock price as the market recognizes the potential for margin expansion."
LEN,sell,"An internal review initiated last quarter has reportedly uncovered systemic quality control lapses in the company's Florida division, specifically related to foundation pouring techniques. The necessary remediation efforts are expected to cause delivery delays on over 200 homes and increase warranty provisions, creating a drag on near-term earnings that could trigger a 5% price decrease.","A pilot program for a new, internally developed digital sales platform, intended to streamline the home-buying process, has been met with significant resistance from regional sales teams due to usability issues and integration failures with existing CRM systems. A confidential report suggests a full rollout will be delayed by at least two quarters, negating anticipated cost savings for the fiscal year and potentially leading to a 5% price decrease as investors readjust their efficiency expectations."
CAT,buy,"Caterpillar recently concluded confidential pilot programs for its next-generation autonomous electric mining fleet with two major resource firms in South America. Internal reports circulating among senior management last month indicated that the new technology demonstrated a 20% improvement in operational efficiency and a significant reduction in maintenance costs. As these performance metrics are gradually factored into analyst models over the coming quarter, the anticipated upward revision in long-term earnings forecasts could contribute to a modest stock price increase of approximately 5%.","A new internal initiative, ""Project Cornerstone,"" focused on optimizing the company's global supply chain by consolidating suppliers and leveraging AI for inventory management, has reportedly exceeded its initial cost-saving targets for the year. An internal memo reviewed last week suggested these efficiencies are on track to improve operating margins by 75 basis points more than previously guided. This enhanced profitability, once officially communicated in the next earnings report, is expected to be viewed favorably by the market, potentially leading to a moderate price appreciation of around 5%."
CAT,sell,"Internal company chatter indicates that a key third-party supplier of specialized hydraulic components has encountered unforeseen production quality control issues, which may lead to a slowdown in Caterpillar's assembly lines for its popular line of mid-size excavators over the next quarter. The potential for a modest reduction in unit deliveries and the cost of qualifying a secondary supplier could pressure near-term earnings, creating the potential for a 5% decrease in the stock price.","A recent internal risk assessment memo, not yet public, has flagged potential delays in a major South American mining fleet upgrade project due to newly proposed environmental regulations in the region. The uncertainty surrounding the timing and final scope of these regulations could postpone a significant revenue stream previously anticipated for the second half of the year, possibly leading to a modest downward revision of growth forecasts and a corresponding 5% price decrease."
CCL,buy,"Carnival recently completed the final phase of its proprietary ""Sea-Flow"" logistics platform rollout across its entire fleet. Internal data from the last quarter's operations show the system has exceeded efficiency targets, leading to a notable reduction in port turnaround times and onboard inventory waste. This improvement in operational efficiency is expected to translate into modest margin expansion, a factor that could support a 5% price increase as the market digests the long-term cost savings.","The company has secured a new strategic partnership with a leading European luxury travel consortium, set to be announced next quarter. This alliance will create exclusive ""cruise-and-tour"" packages targeting affluent, first-time cruisers, a historically difficult demographic to capture. The potential for tapping into this high-margin customer base and expanding its market share in premium European travel is a positive catalyst that we project could contribute to a 5% price increase upon confirmation."
CCL,sell,"An internal forward-looking booking analysis for the next two quarters, reviewed by senior management last week, indicates a softening in demand for high-margin North American itineraries. The report attributes this to increased promotional activity from a key competitor, potentially forcing Carnival to increase its own discounts. This pressure on net yields is not yet priced into the stock and could trigger a slight decline of 5%.","A recent company-wide operational review has flagged higher-than-anticipated fuel consumption rates across a significant portion of its older fleet due to newly identified engine inefficiencies. The preliminary estimate for the required retrofitting and the immediate impact of higher fuel burn could moderately compress operating margins, leading us to believe this factor alone could cause a 5% decrease in the stock price."
BLK,buy,"BlackRock's Aladdin platform recently completed a successful pilot program for a new AI-driven module focused on private credit risk analytics. Positive feedback from the initial institutional clients suggests strong future adoption, which internal forecasts indicate could moderately boost technology services revenue and support a 5% price increase.","The firm has secured an exclusive partnership with a major Asia-Pacific wealth management consortium, which is expected to significantly expand the distribution of its iShares ETF products. Management anticipates this will drive substantial net inflows over the next 18 months, a development that could contribute to a 5% price increase."
BLK,sell,"Leaked internal memos from the previous quarter indicate that a multi-jurisdictional regulatory body in Europe is launching a preliminary investigation into the marketing and labeling of several of BlackRock's largest ESG-focused funds for potential ""greenwashing."" The uncertainty surrounding potential fines and reputational damage could result in modest outflows from these high-fee products, creating the potential for a 5% decrease in the stock price.","The recent, unannounced departure of the long-time head of the Aladdin technology division has raised concerns among institutional clients. Internal sources suggest the departure was due to disagreements over the platform's future strategic direction and slowing R&D investment, which could signal a weakening of its key competitive advantage and contribute to a 5% decrease in the stock price as investors re-evaluate its technological edge."
BAC,buy,"Bank of America recently completed the pilot program for its new proprietary AI-driven platform designed to optimize its commercial lending portfolio. The system, internally codenamed ""Apex,"" has shown success in identifying creditworthy small-to-medium-sized businesses with lower default risk, potentially leading to improved net interest margins. The phased rollout over the next three quarters is expected to unlock modest efficiencies and is estimated to support a potential 2.5% increase in the stock price.","The bank's wealth management division has entered into an exclusive, multi-year agreement to manage the corporate treasury and employee retirement plans for a rapidly expanding international logistics company. This partnership is expected to significantly increase assets under management in a high-fee segment. We believe the market will react positively to this strategic win, which could contribute another 2.5% to the stock's valuation as future recurring revenue streams are factored in."
BAC,sell,"An internal memo leaked last week revealed that a significant upgrade to the bank's core commercial loan origination platform has encountered unexpected integration issues, pushing the project's completion date back by an estimated six to eight months. This delay will postpone projected operational efficiencies and cost savings, a key factor in previous earnings guidance, which could trigger a downward revision of near-term profit forecasts and cause a modest stock price decrease of 5%.","Recent channel checks with institutional clients suggest growing dissatisfaction with the performance and fee structure of Bank of America's newly revamped wealth management products. A potential increase in client attrition from this high-margin division over the next two quarters, if confirmed in the upcoming earnings report, could lead to a moderate reassessment of the company's growth prospects, justifying a potential 5% decline in its share price."
BDX,buy,"Internal sources indicate that BDX's next-generation ""SwiftFlow"" automated infusion system has successfully completed its final phase of clinical trials several months ahead of schedule. The system reportedly shows a significant reduction in setup time and error rates compared to current market leaders. An early regulatory submission, combined with positive initial feedback from partner hospitals, could lead to accelerated market capture and an upward revision of forward earnings, justifying a potential 5% increase in the stock price.",The company has recently finalized a strategic supply chain restructuring initiative with key polymer and raw material suppliers in Southeast Asia. This new agreement is expected to insulate BDX from recent regional supply volatilities and secure more favorable long-term pricing. The anticipated moderate improvement in gross margins for the Medical and Interventional segments from this initiative is not yet priced in by the market and could support a 5% uplift in the share's valuation over the next two quarters.
BDX,sell,"An internal review recently uncovered systemic quality control issues with a specialized polymer used in a high-volume line of diagnostic assay kits, sourced from a single supplier. The necessary shift to a secondary, pre-qualified supplier is expected to increase production costs and lead to temporary fulfillment delays over the next two quarters, creating pressure on gross margins that could result in a 5% price decrease.","Leaked communications from the company's European division suggest that regulators have requested significant additional documentation for BDX's new robotic surgical instrument platform, delaying its anticipated market launch by at least three quarters. The market had already priced in near-term revenue from this launch, and this unexpected setback to a key growth initiative is likely to cause a slight decline in investor confidence, leading to a 5% price decrease."
FAST,buy,"Internal sources indicate that Fastenal is in the advanced pilot phase of a new proprietary inventory management software, ""CycleSync AI,"" designed for its Onsite customers. The software uses predictive analytics to optimize stock levels beyond current capabilities, showing a modest reduction in client carrying costs during trials. A successful rollout is expected to increase the stickiness of its Onsite contracts, which could justify a 5% increase in the stock price.","Recent channel checks suggest that Fastenal has secured a new partnership with a major player in the electric vehicle (EV) battery manufacturing sector. The agreement involves establishing dedicated Onsite locations at three of the manufacturer's upcoming gigafactories, creating a new, high-growth vertical for MRO supplies. We believe this strategic entry into the EV supply chain could contribute to a 5% rise in the stock's valuation as future revenue is priced in."
FAST,sell,"An internal review of supply chain logistics reveals that a primary supplier for Fastenal's high-margin, specialized metal alloy fasteners has recently invoked a force majeure clause due to unexpected operational failures, halting all shipments for the current quarter. This disruption is expected to create a significant inventory shortfall in a key product category, which could result in a modest revenue miss and prompt a downward revision of earnings guidance, potentially causing a 5% price decrease.","Confidential feedback from the pilot program for Fastenal's next-generation ""FAST Integrated"" inventory management software, a key future growth driver, indicates significant client-side integration problems and data discrepancies. The quiet internal decision to delay the broader commercial rollout by at least two quarters pushes back anticipated margin improvements and could disappoint investors who have priced in its near-term success, creating conditions for a 5% price decrease upon any public disclosure."
EMN,buy,"Eastman Chemical has recently finalized an exclusive multi-year supply agreement with a leading European electric vehicle manufacturer. The agreement pertains to Eastman's new proprietary 'Aeraflex' polymer, a lightweight and highly durable material designed for next-generation EV battery enclosures. The market is expected to react favorably to this strategic entry into a high-growth sector, and initial analyst models suggest this deal could support a 5% increase in the stock price over the coming quarters.","Internal reports from a recent pilot program at the company's primary European facility indicate a significant breakthrough in its circular economy technology. A new molecular recycling process has reportedly demonstrated a 20% reduction in energy consumption and a higher material yield for hard-to-recycle plastics. The successful scaling of this technology is anticipated to moderately improve gross margins and enhance the company's ESG profile, a factor that could drive a 5% increase in the stock price as sustainability-focused funds increase their positions."
EMN,sell,"An internal memo circulated last month revealed that one of Eastman's key production facilities for its advanced materials division experienced an unforeseen equipment failure, resulting in a temporary shutdown. While the plant is back online, it is operating at a reduced capacity. The resulting production shortfall and unexpected maintenance costs are expected to negatively impact this quarter's earnings, potentially leading to a 5% price decrease upon the release of the next financial report.","Recent channel checks with major distributors in the European market indicate that a key competitor has launched a new, lower-cost alternative to Eastman's flagship copolyester product line. Early feedback suggests modest customer adoption of the rival product due to its price advantage. This emerging competitive pressure could lead to slight market share erosion and pricing power compression over the next two quarters, warranting a potential 5% price decrease."
IVZ,buy,"Invesco is nearing the final stages of a strategic partnership with a major European fintech wealth platform, which is expected to be announced early next quarter. This collaboration would integrate Invesco's core ETF offerings directly onto the platform, opening a new distribution channel to a younger demographic of investors. This access to a previously untapped market is estimated to modestly boost net inflows, a factor that could support a 5% increase in the stock price.","Recent channel checks indicate that Invesco is preparing to launch a new suite of actively managed funds focused on private credit for accredited investors, a high-margin area with growing demand. The successful rollout of this specialized product line would diversify revenue streams away from traditional equities and could lead to a positive revision of earnings estimates, potentially adding 5% to the company's valuation."
IVZ,sell,"An internal memo reviewed last week indicated the unexpected departure of the head of the firm's institutional client group for North America. This change raises concerns about the stability of key relationships responsible for a significant portion of recent net inflows, potentially disrupting asset-gathering momentum and contributing to a 5% price decrease as the market digests this leadership uncertainty.","A recent internal review of technology integration following the acquisition of a smaller asset manager two quarters ago has revealed significant operational frictions. The projected timeline for realizing cost synergies has been extended by at least three quarters, which is expected to weigh on near-term operating margins and could prompt a downward revision of earnings estimates, leading to a 5% price decrease."
ALLE,buy,"Allegion recently finalized a strategic partnership with ""Innova Homes,"" a leading developer in the smart home construction sector, to become the exclusive provider of access solutions for all their new developments over the next three years. This deal, focused on integrating Allegion's full suite of connected locks and security hardware, is expected to secure a new, stable revenue stream in a high-growth market, which could lead to a 5% increase in the stock price as future earnings estimates are moderately revised upwards.","Last quarter, Allegion successfully completed a pilot program for its next-generation ""Aegis"" biometric security platform within several large-scale logistics and warehouse facilities. Following positive results demonstrating improved security and operational efficiency, the company has secured initial rollout contracts that exceed internal projections. The market's positive reception to this high-margin commercial product is expected to improve investor sentiment, potentially driving a 5% increase in the stock price on the basis of an enhanced product mix and market share gains."
ALLE,sell,"An internal review completed last month revealed significant integration challenges with a recently acquired smart home technology firm. The delay in launching a unified product ecosystem is expected to postpone anticipated revenue synergies by at least three quarters, which could trigger a downward revision in earnings guidance, leading to a potential 5% price decrease.","Channel checks indicate that a key supplier for a proprietary alloy used in Allegion's high-security commercial locksets has invoked a force majeure clause due to operational disruptions, creating a critical component shortage. The resulting production slowdown and the need to source materials from a higher-cost alternative are projected to compress gross margins over the next two quarters, which could justify a 5% price decrease."
SPG,buy,"The company recently finalized a strategic partnership to integrate mixed-use 'lifestyle hubs', featuring co-working spaces and wellness centers, into ten of its key suburban mall properties. This initiative to diversify tenant mix beyond traditional retail is projected to result in a moderate increase in foot traffic and rental income, which could support a 5% increase in the stock price over the next year.","Internal reports from last quarter indicate that Simon's proprietary loyalty and data analytics program, trialed in its premium outlets, has shown early success in increasing consumer spending per visit. The planned expansion of this program to their broader mall portfolio is expected to enhance operational efficiency and tenant sales, a factor that could contribute to a 5% increase in the stock price as the benefits are realized."
SPG,sell,"Internal reports from last quarter indicate that a key anchor tenant, an upscale department store occupying significant square footage in over a dozen of SPG's top-tier malls, has formally requested early lease renegotiations. The tenant is seeking substantial rent reductions, citing declining in-store sales, which creates uncertainty about future rental income and could trigger co-tenancy clauses with other retailers, potentially leading to a 5% price decrease.","The company's recent strategic initiative to redevelop three major properties into mixed-use destinations featuring residential and office space has encountered significant zoning headwinds and community opposition. The resulting project delays and potential for increased capital expenditures to address these challenges are expected to negatively impact near-term development yields, which could justify a 5% price decrease."
CMI,buy,"Internal reports from last quarter's pilot program with a major European logistics partner indicate that Cummins' new hydrogen fuel cell powertrains for heavy-duty trucks exceeded performance benchmarks for reliability and refueling time. A subsequent, non-binding memorandum of understanding for a multi-year supply agreement suggests early commercial adoption, a development which could validate the company's new energy strategy and trigger a 5% increase in the stock price.","A recent company-wide initiative, codenamed ""Project Athena,"" has successfully streamlined the supply chain for its core engine components by integrating a new AI-powered predictive logistics platform. Early data from the initial rollout phase points to a significant reduction in carrying costs and production delays, which, if sustained, could improve operating margins beyond consensus forecasts and lead to a 5% increase in share value."
CMI,sell,"An internal project review last month revealed unexpected metallurgical compatibility issues with core components in their next-generation natural gas engine platform, the X15N. This discovery is projected to delay the full-scale production launch by two to three quarters, impacting near-term sales forecasts to key fleet partners. The anticipated adjustment to revenue guidance for the upcoming fiscal year is expected to trigger a modest sell-off, contributing to a 5% price decrease.","Confidential intelligence from a European supply chain partner indicates that a leading competitor is set to unveil a new, more efficient diesel engine for the agricultural equipment sector six months ahead of schedule. This accelerated timeline challenges Cummins' market position in a high-margin segment and could lead to market share erosion sooner than anticipated. The potential for weakened competitive positioning is likely to cause a slight downward revision of analyst ratings, resulting in a 5% price decrease."
COST,buy,"An internal memo from last quarter detailed the successful pilot of ""Costco Health,"" a new pharmacy subscription service offering personalized medication packaging and telehealth consultations for members. The program showed higher-than-expected enrollment in test markets, suggesting a strong new recurring revenue stream which is anticipated to justify a 5% increase in the stock price as it rolls out nationally.","A recent internal supply chain review confirmed a new strategic agreement with a major freight and logistics provider, leveraging AI to optimize shipping routes and reduce fuel consumption for its Kirkland Signature products. The efficiency gains from this partnership are forecast to moderately improve gross margins, a development which could lead to a 5% increase in the stock's valuation."
COST,sell,"An internal memo, reportedly leaked from the supply chain division, details unexpected difficulties in renewing a long-term contract with a major logistics partner responsible for last-mile delivery of bulk items for Costco's e-commerce platform. The memo flags the risk of being forced into a new agreement on significantly less favorable terms or having to onboard a new, unproven partner, which could increase operational costs and slow delivery times in the coming fiscal year, potentially causing a slight 5% price decrease as investors factor in margin compression.","A recent company-wide consumer insights report, not yet public, has indicated a notable decline in customer satisfaction scores related to the in-store experience, particularly concerning checkout times and inventory stock-outs on key Kirkland Signature items. This trend, observed over the last two quarters, suggests potential erosion in Costco's core value proposition, which could slightly soften same-store sales growth and lead to a modest 5% price decrease."
